"Link","Abstract"
"https://www.scopus.com/inward/record.uri?eid=2-s2.0-85106085205&doi=10.4324%2f9780429346507&partnerID=40&md5=93eda6817cf768a1d2a75987ec638da8","This volume foregrounds the importance of regional cooperation in the context of food security challenges in South Asia. South Asia holds the key to global achievement of SDG targets of ending hunger and malnutrition - it accounts for nearly one-third of food-insecure people on the planet, with every third child suffering from stunting due to malnutrition. Similar food preferences, production systems, and the transboundary nature of agrarian ecosystems call for coordinated action by South Asian countries, complementing national actions dealing with food security challenges. In this volume, leading experts discuss the perspectives of key South Asian countries in leveraging regional cooperation for addressing food security challenges and reflect on the potential of cooperative actions in different areas. The book proposes a ten-point regional policy agenda covering cooperation for combatting climate change, regional trade liberalization, operationalization of regional food reserves, leveraging technology, sharing of good practices, regional institution building, coordinated positions in multilateral trade negotiations, addressing trans-boundary outbreak of livestock diseases, strengthening food safety standards, and the management of shared natural resources. A key volume on accomplishing SDGs in the South Asian context, this book will be of immense interest to policy makers, researchers, and development practitioners. It is also essential reading for scholars and researchers in the areas of development studies, South Asia studies, food security, environment and sustainability. © 2020 United Nations."
"https://www.scopus.com/inward/record.uri?eid=2-s2.0-85068404555&doi=10.1108%2fJTF-01-2019-0004&partnerID=40&md5=10ffa6c9e743e7c0ae266624836a5a0b","Purpose: The purpose of this paper is to provoke reflections on the potential contribution of food tourism experiences to achieving the sustainable development goals for eradicating hunger and malnutrition. Design/methodology/approach: In line with the creative analytic practice in scientific inquiry, this study develops and discusses a futuristic scenario inspired by a factual company. The case is based on ideas derived from studies on educational and food tourism and entrepreneurship, more precisely ecopreneurship. Findings: Food tourism can offer an opportunity for discussing food challenges in the context of ideas and projects to alleviate hunger and malnutrition. This study shows that imagining such possibilities and projects is challenging because of the complexity of the issue. Practical implications: This study suggests that despite some limitations, educational food tourism experiences might go well beyond the issues of regional development, localism and authenticity. Practitioners, including tourism entrepreneurs and private and public food and tourism organisations, might be essential to exploring alternative food tourism futures in ways that truly contribute to urgent global challenges. Originality/value: The value of this paper lies in the use of a scenario to imagine and to reflect on the future of food tourism in relation to the global challenges of hunger and malnutrition. The paper suggests that the ideas from tourism studies and ecopreneurship can offer interesting perspectives on future developments in the sector. © 2019, Giovanna Bertella and Benjamin Vidmar."
"https://www.scopus.com/inward/record.uri?eid=2-s2.0-85060781603&doi=10.1007%2f978-981-10-7650-3_20&partnerID=40&md5=3f0472a54b97c56fd3daae3855ef82b8","Homegardening is an ancient and widespread practice of deliberate mixing of field crops, herbs and shrubs with trees and livestock within the compound of a house, popular in regions with either high or low human population densities in developing and developed countries. They reflect the wisdom of traditional culture and ecological knowledge that have evolved over the years. The gardens resemble the structure of natural ecosystems, i.e. they create a forest-like multi-storey canopy structure on a land marginal to field production and labour marginal to major household economic activities. Multiple environmental and ecological benefits are realized from homegardens in terms of ecologically friendly approaches for food production improving food security and enhancing economic growth along with biodiversity and natural resources conservation. As homegardens are time-tested local strategies that are widely adopted and practiced in various circumstances by local communities with limited resources and institutional support, they can be a part of agriculture and food production systems in many developing countries and are widely used as a remedy to alleviate hunger and malnutrition in the face of a food crisis particularly in a climate change world. © Springer Nature Singapore Pte Ltd. 2017."
"https://www.scopus.com/inward/record.uri?eid=2-s2.0-85124502836&doi=10.4018%2f978-1-7998-2599-9.ch002&partnerID=40&md5=1c9fae841ef17b21dff85b86f9f830dd","The world has understood that hunger is one of the most dangerous problems for the future. Accordingly, food security and sustainability are both important issues through sustainable development. This chapter highlights the role of seafood security and sustainability for sustainable development. In this context, seafood security and sustainability for Turkish seafood market was investigated. Turkey is a coastal country, which has accepted 2030 Sustainable Development Goals, with a seafood market and a good sample to investigate seafood sustainability. This study employed secondary data from TURKSTAT and FAO websites to determine Turkish seafood market profile. The study determined seafood security and sustainability based on five dimensions as availability, economic access, physical access, utilization, and stabilization. Seafood sustainability is vital for coastal countries because seafood market brings economic, social, and environmental benefits at the same time. © 2021, IGI Global."
"https://www.scopus.com/inward/record.uri?eid=2-s2.0-85100182310&partnerID=40&md5=ca5aa4b2259fd3718a717a843cb77f56","The 2030 Agenda for Sustainable Development, specifies 17 goals among which the second one: ending world hunger, achieving food security, improving nutrition and promoting sustainable agriculture in order to guarantee the reduction of food waste. The goal of this paper is, therefore, investigating the methodologies to reduce food waste. To this end, we present an application case study in the MAAS Agri-food center: the Mediterranean logistics hub and pride of the wholesale fruit and vegetables, fish and floriculture markets. MAAS has decided to adhere to the “Law n. 166 of 19 August 2016” for the waste reduction. The purpose is promoting the recovery and donation of surplus food, giving priority to human use. MAAS is open to collaborate with the Banco Alimentare Foundation, which deals with the collection of foodstuffs and the recovery of surplus food from agricultural and industrial production and therefore, the recovery of vegetable waste with a view to a more efficient use. © 2020. All rights reserved"
"https://www.scopus.com/inward/record.uri?eid=2-s2.0-85074979540&doi=10.1080%2f1389224X.2019.1690014&partnerID=40&md5=b59a3e8c73384e551639d4f8443e2a1e","Purpose: The purpose of this study was to describe faculty and graduate students’ motivation and learning experiences in a multi-institutional, interdisciplinary graduate course focused on the nexus of food and nutritional security, hunger, and sustainability. Design/Methodology/Approach: A one-group pre-experimental case study design was used. Faculty and students completed questionnaires, which included rating scales and open-ended questions. Data were analyzed and triangulated into key findings. Findings: Results indicated that faculty were interested and engaged in the development of the interdisciplinary course, and students were engaged in interdisciplinary learning and developed communication and education skills through experiential place-based learning. Practical Implications: Faculty developed a common understanding of their different disciplinary perspectives that helped provide a more cohesive and complementary interdisciplinary learning experience for students. Students learned about global challenges while identifying similar challenges in their local communities through the experiential learning assignments. Theoretical Implications: The design of the interdisciplinary course helped students think critically and creatively to learn complex issues. Advances in technology and active learning support a flipped classroom model to engage students. Place-based learning combined with interdisciplinary classroom experiences connected students to local real-world contexts and provided students with practical applications of problem-solving, critical thinking, and systems thinking skills. Originality/Value: Graduate students conducted an asset and needs assessment, which connected them to professionals in the community. Students think food and nutritional security, hunger, and sustainability are global challenges and seldom notice food insecurity in their local communities. © 2019, © 2019 Wageningen University."
"https://www.scopus.com/inward/record.uri?eid=2-s2.0-85087943071&doi=10.1016%2fj.gfs.2020.100380&partnerID=40&md5=35cd3524deb4aeeced330e6a1600175f","Fish is an important dietary source of micronutrients, particularly in low-and middle-income countries. In Ghana, effective management of fish and the fisheries is essential for food, economic and nutrition security and is critical towards achieving many of the UN Sustainable Development Goals especially those pertaining to hunger, poverty, gender equality and life under water. Ghana has experienced significant economic growth in the last few decades, but increasing inequality, uncertainties in fish availability and unsustainable management of the fisheries are challenging local food and nutrition security. This literature review examines and evaluates the role of fish and fisheries in supporting FNS in Ghana, and highlights the lack of focus on fish in the literature with regard to regional food security and fisheries governance. Our review highlights the importance of ensuring the viability of small fish populations to enhance micronutrient availability and counteract micronutrient deficiencies in Ghana. Additionally, strengthening women's role in decision making and promoting female education and empowerment in the fisheries sector is an important strategy towards enhancing FNS in the region. © 2020 The Authors"
"https://www.scopus.com/inward/record.uri?eid=2-s2.0-85021449217&doi=10.1002%2fj.1681-4835.2017.tb00598.x&partnerID=40&md5=6cd2fcd460de67f88d52095060d18b53","The 43rd Committee on World Food Security (CFS) convention reiterated the importance of livestock towards eliminating food insecurity across the globe. Livestock provides extensive services and products which are critical in addressing the issues of hunger, malnutrition, health and diseases. However, despite such importance, livestock systems across the globe continue to face the challenge of sustainability. In this research article, using ethnographic research techniques, we examine the Beitbridge livestock systems to understand the vulnerabilities within the system and current efforts to overcome. The article identifies that the Beitbridge livestock system, similar to many others, faces numerous socio-ecological and political economy challenges. Also, in the past engagement of the author and the community, it emerged that there was limited use of digital technologies within the community. Therefore, this study explore whether digital technologies can contribute towards sustainability of livestock and if so, how. The major findings of the study are that, DTs have affordances which can be exploited to contribute towards the sustainability of the livestock system. However, in order for this to happen, there is need for convergence of conditions e.g. Presence of supporting institutions and improvement of digital infrastructure. These findings confirm the need for context based studies on DTs. The findings of the study provide practitioners and policy makers 'something to think about' in the development of DTs and supporting systems."
"https://www.scopus.com/inward/record.uri?eid=2-s2.0-85032890071&doi=10.1177%2f1010539517736441&partnerID=40&md5=6206b23389a6e8aa9e37de8eb435d83f","The Sustainable Development Goals (SDGs) replaced the Millennium Development Goals (MDCs) in 2015, which included several goals and targets primarily related to nutrition: to eradicate extreme poverty and hunger and to reduce child mortality and improve maternal health. In the Asia-Pacific Academic Consortium for Public Health (APACPH) member countries as a group, infant and child mortality were reduced by more than 65% between 1990 and 2015, achieving the MDG target of two-thirds reduction, although these goals were not achieved by several smaller countries. The SDGs are broader in focus than the MDGs, but include several goals that relate directly to nutrition: 2 (zero hunger—food), 3 (good health and well-being—healthy life), and 12 (responsible consumption and production—sustainability). Other SDGs that are closely related to nutrition are 4 and 5 (quality education and equality in gender—education and health for girls and mothers, which is very important for infant health) and 13 (climate action). Goal 3 is “good health and well-being,” which includes targets for child mortality, maternal mortality, and reducing chronic disease. The Global Burden of Disease Project has confirmed that the majority of risk for these targets can be attributed to nutrition-related targets. Dietary Guidelines were developed to address public health nutrition risk in the Asia Pacific region at the 48th APACPH 2016 conference and they are relevant to the achievement of the SDGs. Iron deficiency increases the risk of maternal death from haemorrhage, a cause of 300000 deaths world-wide each year. Improving diets and iron supplementation are important public health interventions in the APACPH region. Chronic disease and obesity rates in the APACPH region are now a major challenge and healthy life course nutrition is a major public health priority in answering this challenge. This article discusses the role of public health nutrition in achieving the SDGs. It also examines the role of APACPH in education and advocacy and in fulfilling the educational needs of public health students in public health nutrition. © 2017, © 2017 APJPH."
"https://www.scopus.com/inward/record.uri?eid=2-s2.0-85098161364&doi=10.15302%2fJ-FASE-2020342&partnerID=40&md5=8622f23df33b931a6e1a5903b0551b12","Africa in facing numerous challenges in the 21st century in feeding its rapidly increasing population. Land resources have become limited due to urbanization and industrialization. The existing agricultural land has been degraded and soil fertility has declined due to unsustainable farming practices. Despite of progress made in the past several decades, hunger and malnutrition in Africa still hinder health, human development and economic growth, which will become even worse in the future if proper measures are not taken. Sustainable intensification is the only solution to tackling both environmental sustainability including climate change and malnutrition, i.e., to produce more foods in terms of nutrients human body needs with less natural resources and carbon emissions. To achieve this vision, innovations in technologies, policies and institutions are essential. The Chinese experience in Agricultural Green Development (AGD) can be shared with Africans when the region is pursuing its sustainable intensification strategy. © 2020"
"https://www.scopus.com/inward/record.uri?eid=2-s2.0-84967225641&doi=10.4324%2f9781315670935&partnerID=40&md5=43692c5d4ff7f8db71fca04b26af70aa","In this second edition of The Sociology of Food and Agriculture, students are provided with a substantially revised and updated introductory text to this emergent field. The book begins with the recent development of agriculture under capitalism and neo-liberal regimes, and the transformation of farming and peasant agriculture from a small-scale, family-run way of life to a globalized system. Topics such as the global hunger and obesity challenges, GM foods, and international trade and subsidies are assessed as part of the world food economy. The final section concentrates on themes of sustainability, food security, and food sovereignty. The book concludes on a positive note, examining alternative agri-food movements aimed at changing foodscapes at levels from the local to the global. With increased coverage of the financialization of food, food and culture, gender, ethnicity and justice, food security, and food sovereignty, the book is perfect for students with little or no background in sociology and is also suitable for more advanced courses as a comprehensive primer. All chapters include learning objectives, suggested discussion questions, and recommendations for further reading to aid student learning. © 2016 Michael Carolan. All rights reserved."
"https://www.scopus.com/inward/record.uri?eid=2-s2.0-85103403231&doi=10.11576%2fbiuz-4106&partnerID=40&md5=8eebd7c02e6c020e9e224b5469c453d7","Biological processes represent the major driving forces in the global carbon (C) cycle. The extent of anthropogenic CO2 release threatens our future and is not tolerable. The increase in atmospheric CO2 reflects the cumulative effect of human activities over more than a century and must be stopped. The contribution of photosynthesis to the binding of excess CO2 could be increased if other limitations such as limited N- and P-availability were overcome. The productivity of various types of vegetation increases upon application of fertilizers. However, N-fertilization jeopardizes natural biomes, alters the rhizosphere, decreases the biodiversity and stimulates the release of potent greenhouse gases such as CH4 and N2O. Therefore, fertilization must be restricted and fails as global solution to increase CO2 binding in biomass in context of climate action. Worldwide afforestation appears a powerful action. However, its capacity to reduce CO2 is sometimes overestimated. The consequences of afforestation on land use change, conservation of natural biomes, crop food prices and socio-economic traditions need to be considered. High priority must be given to the reduction of CO2 emission by combustion. In addition, there is urgent need to technically develop and economically implement negative emission technologies. Decisions in context of climate actions must be placed in the framework of all sustainable development goals including no poverty and no hunger. © 2021 Die Autoren. Biologie in unserer Zeit."
"https://www.scopus.com/inward/record.uri?eid=2-s2.0-85019878690&doi=10.17660%2fActaHortic.2017.1158.1&partnerID=40&md5=f6f86bb006ea0517826994253411a7f0","In Sustainable Development Goal 2, the UN has sought to abolish both hunger and malnutrition by ensuring the continuous supply of sufficient, wholesome food enabling people to shift towards adopting healthier, well-balanced diets. In addition, it calls for the establishment of new ways to reduce current food wastage, farming in a manner which conserves biodiversity and environmental services, increases enterprise profitability through new business models and empowers women. Finally, it seeks for governments to create coherent policies at all levels allowing these positive changes in farming systems to take place in every country. Moringa will play a key role in helping these desirable visions be attained. Moringa is a reasonably unique species as its fresh leaves and pods are both edible and extremely micronutrient dense. Its dried leaves are a good micronutrient source in food fortification for chronically underfed and malnourished children. It is a fast growing, productive tree that adapts well to a range of environments, especially in hot, semi-arid regions and is, thus, a climate-resilient crop. It grows well in a wide range of production systems from a densely planted green vegetable repetitively harvested crop, to a fullygrown tree crop which can be harvested periodically when needed. Use of this diversity of production systems in specialized environments can promote in-situ germplasm conservation, soil conservation, sustainable production systems, enhanced profitability and a continuous source of vitamins and minerals for smallholder farm families, and often - all of these attributes together. This species is thus a boon to women small-holders as it enables them to better provide their children with highly nutritious food direct from the family home garden or by procurement in the local market. Likewise, its good productivity and wide range of adaptability helps to develop resilience in farm enterprises and to ensure better enterprise profitability and sustainability."
"https://www.scopus.com/inward/record.uri?eid=2-s2.0-85055910529&doi=10.3390%2fsu10114001&partnerID=40&md5=18c87a346b1597bf6d341faaf8e7100d","Our global food system is characterized by an increasing concentration and imbalance of power, with trade-offs between hunger, inequality, unsustainable production and consumption, and profit. A systematic analysis of power imbalances in food systems is required if we are to meet the 2030 Agenda vision of promoting sustainable production and consumption patterns and ending hunger and poverty. Such an analysis, with a view to a transformation to more sustainable and just food systems, requires tools to be developed and tested in real-life case studies of food systems. To better understand the structures and mechanisms around power in food systems, this study applies a political ecology lens. We adapted the ""power cube"" analysis framework that was proposed by the Institute of Development Studies for the analysis of spaces, forms, and levels of power. We apply the analysis of these three dimensions of power to two food systems in the tropical lowlands of Bolivia: one agroindustrial and one indigenous. After identifying food system actors, the food system spaces in which they interact, and what forms of power they use at what levels, we discuss some implications for an emerging scientific culture of power analyses in critical sustainability assessments. Mechanisms of hidden power undermine visible legislative power in both case studies, but in our example of an indigenous food system of the Guaraní people, visible power stays with a local community through their legally recognized and communally owned and governed territory, with important implications for the realization of the right to food. © 2018 by the authors."
"https://www.scopus.com/inward/record.uri?eid=2-s2.0-85079257719&doi=10.1016%2fB978-0-08-100596-5.22362-7&partnerID=40&md5=17eb2a9e67047568d5aebe8da3ed8d83","Current global agricultural production could feed the entire world population. However many challenges face the food economy nowadays: persistence of poverty, hunger and malnutrition, intensification of environmental problems, climate change and the critical erosion of biodiversity. The alarms coming from scientists and the epistemic communities worldwide, debated also in international fora, have given rise to new emerging social-agricultural movements and practices and a wide debate on how to remedy the problems identified so far. This article exposes the vision and approaches of the Civic Food Networks to the global food challenges under three forms of re-connection: agriculture to nature, farmers to consumers, urban to rural areas. © 2019 Elsevier Inc. All rights reserved."
"https://www.scopus.com/inward/record.uri?eid=2-s2.0-85149529822&doi=10.1007%2f978-3-030-22522-3_4&partnerID=40&md5=604a8a71d5113519ff01e5b43730d723","Our daily food choices have a huge impact on the environment and on climate change. Animal based protein production in particular is very resource consuming. To satisfy the growing meat hunger in the world, alternative protein sources are needed that both have a smaller environmental impact and are readily accepted by consumers. Compared to beef and pork, plant and insect proteins can be produced more sustainably, although consumer acceptance may pose a particular challenge for the latter. In this chapter, we will explore Western consumers’ acceptance of insects as food source and influencing factors. In particular, the role of emotional reactions towards insects, such as disgust and motivational barriers for the acceptance of insects as food will be discussed. Furthermore, the role of concepts taken from risk research, such as risk and benefit perception and trust, will be explored. Relevant characteristics of the insect product itself in terms of processing degree for consumers’ willingness to eat will be highlighted. To further increase the sustainability of the insect production, food waste could be used as insect feed instead of more resource intensive feeds. The impact of different insect feeding styles on consumer acceptance and risk perception will be explained based on recent study results. Lastly, research gaps will be emphasized and strategies to overcome rejection of insects as food will be suggested. © Springer Nature Switzerland AG 2019."
