"Link","Abstract"
"https://www.scopus.com/inward/record.uri?eid=2-s2.0-84866304573&doi=10.1080%2f19320248.2012.703470&partnerID=40&md5=1376cb00c33517a3db3f446b0644938d","This study examines Heifer International's alternative break and its impact on dietary and sustainable food system change for participants. The program teaches college participants about ending poverty and hunger while caring for the earth through incorporating sustainable practices into daily life. Although increases in local/organic foods were observed, there were no significant changes in dietary quality. Significant increases in local/organic food consumption for individuals who consumed less than 50% of their calories from sustainable foods at baseline were observed, based upon paired t-tests (P <.05). Dietary changes varied in significance based upon previous sustainable food consumption exposure and habits. © 2012 Copyright Taylor and Francis Group, LLC."
"https://www.scopus.com/inward/record.uri?eid=2-s2.0-77953259650&doi=10.1177%2f097168581001500205&partnerID=40&md5=7bc32343135070ba7bc8f404a4c8010a","Bottom of the Pyramid (BOP) strategies recognize for the first time that global companies can contribute to the alleviation of worldwide poverty by adopting non-traditional and mostly non-Western models of business involvement. It is now widely accepted that poverty and hunger arise not because there are no goods or food, but because billions of people lack income to purchase them. It is also a common belief that the private sector can play a significant role in lifting the poor from the margins of the market system. This would require strategic and mindset shifts in global companies leading to a very different path where their operations intersect with the greater good of communities, societies, and nations. Successful engagement in the untapped market space at the base of the global income pyramid calls for completely new capabilities, responsibilities, and values. Alliance building with local and non-traditional partners, promoting bottom-up solutions and understanding social sustainability are some of these new managerial challenges. This article reflects on some of the critical challenges of global companies and global managers in their strategic engagement at the BOP and explores how large firms can become involved in the pursuit of social capital acquisition and how new approaches of public-private partnerships in reformulating the profit-performance links, the downscaling of products or services without compromising their quality and integrity, the bridging of the information and infrastructure gap, educating, and empowering the poor, together with innovations through technological adaptations can be managed through the embracing of new mindsets. A number of frameworks are presented with a view to contributing to the debate and outlining new value objectives for global companies."
"https://www.scopus.com/inward/record.uri?eid=2-s2.0-0026437531&doi=10.1016%2f0277-9536%2892%2990224-E&partnerID=40&md5=7a70eb1b3a90cca370be9bc85e50f1cf","This survey examined the processes by which programs feeding hungry children in Canada are initiated, implemented and sustained. The responses of 32 operators of these programs were obtained by semi-structured telephone interviews and were analysed using qualitative research methods. Concerned citizens within the community and teachers were the major proponents for programs; their primary indicators of need were children's hunger-related behaviors. Programs generally provided the breakfast or luch meal, were overseen by a board, and were operated by a mix of paid and volunteer staff. A lack of resources, problems with parents and the community, and managerial stresses were the main perceived barriers to program continuance. Programs run by communities generally had more need for resources, expressed lower confidence in their sustainability, and were less likely to cooperate with other groups than school-run programs. While some programs deliberately tried to avoid stigmatization, program operators did hold some prejudicial views about the communities they served and few programs could be considered empowering to users. © 1992."
"https://www.scopus.com/inward/record.uri?eid=2-s2.0-66549099179&doi=10.1061%2f40971%28310%29104&partnerID=40&md5=61034bb6c6e938336e5439f073858aee","Increasing per capita resource consumption in developed nations on one hand and global poverty, hunger, and poor sanitation in some poor countries on the other hand require efforts directed at both environmental and social sustainability. A model is presented for addressing sustainability in society. In this model, society, environment, and technology are interlocking parameters that dictate the nature and types of efforts for sustainability. Society provides for all its citizens the very basic necessities: potable water, food, education, housing, and sanitation. Environment (or ecosystem) includes the natural resources possessed by society. Technology enables the resources to be exploited economically in service to society, and determines the value of the resource. These factors must be considered simultaneously in developing appropriate and sustainable solutions for an environmentally and socially just society. The model is applicable to any country that seeks sustainability and justice for its citizens. Specific examples related to the use of geo- and bio-materials are presented, including production of adobe-like and fired clay bricks and bamboo beams. Distinctions between technology- and energy-intensive production in developed countries and labor-intensive production in developing countries are made, considering the United States and India as examples. Copyright ASCE 2008."
"https://www.scopus.com/inward/record.uri?eid=2-s2.0-84894069722&doi=10.3390%2fsu5114797&partnerID=40&md5=e646ee0717234e7aa5d12e4c93837cb9","With the growing demands from a population expected to reach 9 billion people by 2050, it is unclear how our current global food system will meet future food needs. Ensuring that all people have access to adequate and nutritious food produced in an environmentally and socio-culturally sustainable manner is one of the greatest challenges of our time. ""Sustainable diets"" have been proposed as a multidimensional framework to address the need for nutritious and adequate food in the context of the many challenges facing the world today: reducing poverty and hunger, improving environmental health, enhancing human well-being and health, and strengthening local food networks, sustainable livelihoods and cultural heritage. This paper examines the contribution of forests and trees to sustainable diets, covering among others, nutritional, cultural, environmental and provisioning aspects. The literature reviewed highlight major opportunities to strengthen the contribution of forest and tree foods to sustainable diets. However, several constraints need to be removed. They relate to: cultural aspects, sustainable use of non-wood forest products, organization of forest food provisioning, limited knowledge of forest food composition, challenges in adapting management of forests and trees to account for forest foods, and in integrating forest biodiversity into complex landscapes managed for multiple benefits. Finally, the paper identifies research gaps and makes recommendations to enhance the contribution of forest foods to sustainable diets through increased awareness and better integration of information and knowledge on nutritious forest foods into national nutrition strategies and programs. © 2013 by the authors; licensee MDPI, Basel, Switzerland."
"https://www.scopus.com/inward/record.uri?eid=2-s2.0-84960227870&doi=10.3920%2f978-90-8686-784-4_37&partnerID=40&md5=7a53b46a960984975b846683659752a1","The 'productionist paradigm' in agriculture emphasizes high tech inputs and high material output. Its assumed main ethical value is the concept of justice as fair distribution of outputs, with the main aim to reduce hunger and to optimalize sustainability. Although this paradigm can be proud of its enormous success to feed the world, it also produces huge problems, which make it unsustainable and not fair. The approach decreases biodiversity, increases erosion, is animal unfriendly and depletes scarce resources. It has an huge impact on climate change and its economic and patenting system increases the gap between rich and poor, thereby reducing chances for rural livelihood, producing unemployment, inherently instable social relations and food insecurity. Probably, it can produce food for even more than eight billion in 2050 with enormous cost. The agrosystem approach, its alternative, starts with local farming practices and innovation activities. It implicitly acknowledges the ethical value of how to lead a good life. However, variants of this approach either give farmers full priority in what and how to produce (as in agrarianism) or give consumers the lead (as in urban gardening). The current utilitarian and deontological ethical approaches are quite blind for how to deal with these strategies that cut across justice, good life and other values. Due to the dynamics of social, economic and cultural systems, agricultural priorities cannot anymore be established one sided by either farmers (and producers) or consumers. Sustainability and climate change require changing consumer food styles (in expanding urban areas) and new farming styles. To improve the approach of agrosystem into one of plural and democratic agrosystems, I propose to make room conceptually for the negotiation and cooperation of farmers and consumers about their interests, preferences and values. In this revised agrosystem approach a concept of justice is assumed not as fair distribution but as fair recognition of farming and food styles. This ethical notion enables to take into account the pluralism of farming and food styles and various interactive ways of intensification and innovation with consumers. © Wageningen Academic Publishers. The Netherlands, 2013. All rights reserved."
"https://www.scopus.com/inward/record.uri?eid=2-s2.0-0035715568&doi=10.1023%2fA%3a1013376922354&partnerID=40&md5=118bd911df847fe8b2fee15cc304bf35","Bangladesh is an agricultural country. About 80% of the total population live in rural areas. The contribution of agriculture to the gross domestic product is 30%. Rice is the major food crop while jute, sugarcane and tea are the main cash crops. Other important crops are wheat, tobacco, pulses, vegetables and fruits. Overall productivity in Bangladesh is stagnating or declining. The implication of yield stagnation or declining productivity is severe, since these trends have occurred despite rapid growth in the use of chemical fertilisers. Depletion of soil organic matter is the main cause of low productivity, which is considered one of the most serious threats to the sustainability of agriculture in Bangladesh. In Bangladesh, most soils have less than 17 g/kg and some soils have less than 10 g/kg organic matter. Farmers realise that there is a problem with soil fertility related to organic matter depletion. Farmers say that organic matter increases yield, reduces the production cost, improves crop growth and the economy, increases water-holding capacity and improves the soil structure. They recognise soil with higher organic matter content by darker brownish to black in colour. Some farmers are using fast-growing trees such as Flemingia macrophyla, Ipilipil (Leucaen leucophala), Glyricidia sepium, Boga Medula (Tephrosia candida), Dhol Kolmi (Ipomoea fistulosa), etc., as living fences, which can be used as fuel, fertiliser and fodder. To increase the soil organic matter, farmers use green manure crops, compost, quick compost, cow dung, azolla, etc. However, fuel for cooking purposes is limited and cow dung and crop residues are largely used as fuel. Crop residues are also used as fodder for livestock. Farmers expressed the wish to learn more about organic fertilizer management. However, sufficient food should be produced to keep pace with population growth. To alleviate the hunger and poverty is to increase the intensity of agricultural production and maintain favorable ecological conditions. Therefore, more organic matter should be used in the farmers' fields to sustain the soil fertility in an intensive farming system."
"https://www.scopus.com/inward/record.uri?eid=2-s2.0-0027760379&doi=10.1016%2f0167-8809%2893%2990014-G&partnerID=40&md5=44524175c80535bfa8f8fe6911ba6858","In many developing countries, a large proportion of the population resides and works in rural areas. Agriculture is the dominant sector in rural areas and has the greatest concentration of poverty: landless workers, small tenant farmers, and small farm owners. Thus, any development strategy that is directed towards increasing employment and alleviating a country's hunger must concentrate on sustainable agricultural growth. Historically, economic development, in most countries, has been based on exploitation of natural resources, particularly land resources - in large part because these resources have been undervalued by private markets and political systems. Soil erosion and land degradation have been serious worldwide. Due to reasons such as high population pressure on land, and limited fossil energy supplies, land degradation is more serious in the developing world. Empirical studies show that soil erosion and degradation of agricultural land not only decrease land productivity but that they can also result in major downstream or off-site damage (e.g. reduction of hydroelectric production) which may be several times that of on-site damage. An earlier analysis identified the factors that determine the agricultural production growth rate in 28 developing countries. This study involved statistical estimation of an aggregate agricultural growth function based on cross-country data. The overall results showed that price distortions in the economy and land degradation had statistically significant negative impacts while the change in arable and permanent land was positively related to the growth of agricultural production and food production in 28 developing countries from 1971 to 1980. These results emphasize the importance of 'getting prices right' and implementation of sustainable land and water management practices if future growth in food and agricultural output is to be realized and sustained in developing countries. © 1993."
"https://www.scopus.com/inward/record.uri?eid=2-s2.0-84882574662&doi=10.1080%2f03031853.2013.821741&partnerID=40&md5=fcf0ceb68a3ea37f795013da432a21fd","Almost two decades after South Africa's political transformation, the country's food security context demands serious attention amidst excessively high unemployment and depressed economic growth. Although food insecurity at household and individual levels is unacceptably high in South Africa, the nation has for decades reported its aggregate national position as ""food secure"". This paper examines the purpose and proposals presented in the National Development Plan and New Growth Path Framework against the development requirements of sustainability, productivity and efficiency, reflects on the implications of the proposals on the right to food, and makes recommendations for the design of a comprehensive national food security policy. © 2013 Copyright Agricultural Economics Association of South Africa."
"https://www.scopus.com/inward/record.uri?eid=2-s2.0-85040089127&doi=10.3920%2f978-90-8686-813-1_12&partnerID=40&md5=0030a70c138d81f6a009471bfdf01745","Biogas production has expanded tremendously in recent years and has become an important feature of modern agriculture. Within this development public subsidies have played a major role by making biogas production from raw plants highly competitive. Social acceptance should be important in contemporary political decision making: that is why we decided to ask people for their perceptions of and their attitudes towards biogas production in agriculture. We used a two-step approach, starting with the conduction of focus groups discussions in three German cities, followed by an online survey. The content of the online survey was based on the outcome of the focus group discussions. By means of factor and cluster analyses we classified the respondents into homogenous groups with regard to their attitudes towards biogas production. The results show that citizens' knowledge of biogas production and of its possible consequences is low. Generally, the production of biogas is well accepted by German citizens. They acknowledge biogas production to be a form of renewable energy, which contributes to overall sustainability goals. But, people are concerned about competition of biomass production for electricity and feed and food production, having in mind that hunger is an important issue worldwide. According to the test person's opinion organic waste should be preferred over fresh biomass. In contrast to what had been expected from earlier media reporting, neither changes in the landscape due to high shares of maize nor significant annoyances of people living close to biogas facilities caused by noise, smell or dirty roads were feared. The factor and cluster analyses resulted in the following groups of people: 'Opponents', 'Indifferents' and 'Supporters' of biogas production. The results of our research confirm earlier research outcomes on German citizens' attitudes in favour of fostering the use of renewable energies. Consistently, people also support the use of biogas. But, people are concerned about the likely competition of land used for the production energy plants with that used for food and feed. Considering that biogas production from energy plants causes quite high CO2-abatement costs, resolute political action towards replacing energy plants in biogas production is urgently needed."
"https://www.scopus.com/inward/record.uri?eid=2-s2.0-84913610251&doi=10.1007%2fs12571-014-0395-8&partnerID=40&md5=423845e99d82acc8e469ba2b99bb7de5","This paper argues that a territorial approach provides an effective analytical framework to address the structural and emerging issues of food security and nutrition (FSN), including widening within-country inequalities and disparities, in so far as they allow the exploration of the multi-dimensional, multi-actor and multi-level nature of FSN. By recognizing the diversity of territories and their distinct capacity to react to shocks (external and internal), a territorial approach is also suitable for tackling the sources of inequality. This involves putting local institutions at the forefront of the battle against FSN problems in order to ensure the achievement of the triple objective of equity, economic efficiency and environmental sustainability. The paper acknowledges that following a territorial approach is complex and often connected to a number of prerequisites that are sometimes not available in developing countries. These include efficient governance systems, access to information, and capacities of actors, organizations and institutions at all levels. Notwithstanding this, our examples indicate that the chances of success of territorial approaches in developing countries are not necessarily lower than for other countries, if appropriate actions are taken. © 2014, Springer Science+Business Media Dordrecht and International Society for Plant Pathology."
"https://www.scopus.com/inward/record.uri?eid=2-s2.0-84879599401&doi=10.17660%2fActaHortic.2013.979.31&partnerID=40&md5=db1509fe3fb3859edc51225df5dcd52c","The International Assessment of Agricultural Knowledge, Science and Technology for Development (IAASTD) defined multifunctional agriculture as the inescapable interconnectedness of agriculture's different roles and functions: namely the production of food and non-food commodities; delivery of environmental services; the improvement of rural livelihoods; and the upholding of traditional crops and local culture. Together these outputs should create greater environmental, social and economic sustainability. These goals mirror those of agroforestry, which has been described as a significant mechanism for the delivery of multifunctional agriculture. Agroforestry outputs are delivered in three steps: i) rehabilitation of degraded land; ii) the domestication of underutilised plant species; and iii) the commercialisation of agroforestry tree products (AFTPs). Interestingly, past crop domestication has been credited with being a ""perquisite for the development of settled, politically centralised, socially stratified, economically complex and technologically innovative societies"". While there is good evidence of this, the benefits of modern agriculture based on staple food crops have not been equitably distributed and developing country farmers have been marginalised. In the mid-1990s a new wave of participatory crop domestication was initiated. This second wave of domestication, led by the World Agroforestry Centre, has focused on underutilised tropical trees producing highly nutritious fruits and nuts which provide the everyday needs of smallholder farmers. Recent evidence from Cameroon indicates that the domestication of these new tree crops within an integrated approach to rural development delivering multifunctional agriculture, can transform the lives of poor farmers. It also has positive impacts on the environment and creates new business and employment opportunities in rural communities. Thus it seems that, if widely implemented, this new pro-poor wave of domestication could have large impacts on global food production and the alleviation of malnutrition, hunger and poverty in developing countries."
"https://www.scopus.com/inward/record.uri?eid=2-s2.0-0028866909&doi=10.1007%2fBF00814060&partnerID=40&md5=56adc308a2ff62a9036f3ee8db78379d","Three issues related to hunger, famine and food security are highlighted by the problems faced by ""indigenous peoples"" in many parts of the world. They affect not only the indigenous groups themselves, but also the potential for improved and increased food availability for the rest of humankind. First, indigenous peoples themselves continue to be subjected to the shock impact of outsiders in ways that remove their traditional access to land and other resources, especially those that provide customary sources of foods. The shock is therefore very negative in nutritional as well as the better-known cultural and health terms. Second, the destruction and disruption of many indigenous peoples is reducing the pool of knowledge (""ethnoschience"") available concerning the biosphere and natural resources, which is of widespread value to humanity. Thirdly, this compounds the already well-known shock impact of the ""invaders"" on those natural resources through environmental destruction and habitat alteration. These issues have a potential impact on global sustainability that is far greater than might be suggested by the small numbers of indigenous peoples involved. The paper argues for priority to be given to the links between hunger and food problems, the human rights of indigenous peoples, and environmental destruction. © 1995 Kluwer Academic Publishers."
"https://www.scopus.com/inward/record.uri?eid=2-s2.0-84904571908&doi=10.1017%2fS0029665114000135&partnerID=40&md5=44162b2966f02f016f62664c0e60b921","The aim of the present paper is to review nutrition transition (NT) ongoing in low and middle income countries and the associated dietary changes. NT is accompanied by demographic and epidemiological transition associated with economic development and urbanisation. In these countries, while the problems of hunger and undernourishment persist, there is an escalation of diet-related non-communicable diseases; making them face both problems of malnutrition, under and overnutrition. Indeed, in addition to protein energy malnutrition underweight and micronutrient deficiencies affect a high proportion of children and women. Conversely, changes in dietary habits and physical activity patterns have led to emergence of chronic diseases such as obesity, diabetes, hypertension, stroke, hyperlipidaemia, CHD and cancer. One possible explanation of weight gain and its associated health consequences is the trend of the consumption of already prepared meals and the restaurants that are in continuous development leading to high consumption of foods rich in sugar and fat. The health problems associated with NT have not spared populations in the Mediterranean area where the type of diet is reported to be healthy and to protect against cardiovascular risks. This is seen in North Africa that belongs also to the Mediterranean basin, where the nutritional situation raises the problem of traditional foods sustainability. Accurate nutritional policy and education are needed to redress the effects of malnutrition related to NT on health. © The Authors 2014."
