"Link","Abstract"
"https://www.scopus.com/inward/record.uri?eid=2-s2.0-85115704807&doi=10.1186%2fs41182-021-00370-8&partnerID=40&md5=42cb3e5e7dfba7e0a8f0a844e8a2f2d8","Food security is a major element for the sustainability, stability and development of a country. However, despite fundamental efforts in fighting poverty, Afghanistan continues to struggle with food insecurity with a large proportion of its population living below the poverty line. With extreme climates, protracted conflict, and now COVID-19, food insecurity has become rampant and is on the rise in the country. Efforts have been reinforced to mitigate this issue, but a spate of obstacles which seems not to come to an end, has contributed to the deterioration of the situation. With the collaboration and efforts of international organizations, there remains a glimmer of hope to potentially reduce the gravity of the food insecurity in the country. This paper aims to highlight the efforts of Afghanistan in alleviating food insecurity with a focus on the impact of COVID-19 on this issue. It also presents recommendations that may help ameliorate the country’s food security status during and after the pandemic. © 2021, The Author(s)."
"https://www.scopus.com/inward/record.uri?eid=2-s2.0-85137168277&doi=10.1016%2fj.jclepro.2022.133698&partnerID=40&md5=74abbc75fb2111c3b605801965ea286e","Food organizations have seen pressure from stakeholders, consumers, governments, and other international agencies to adopt sustainable practices in their business operations. Sustainable development is the current need for the agri-food sector to achieve the sustainable development goals (SDG) established by the United Nations. Sustainable development improves social well-being, environmental well-being, and economic growth. Regular performance monitoring plays an important role in the adoption of sustainable practices. This study developed a sustainable performance assessment (SPA) framework through integrated triple bottom line (TBL) and circular economy practice. The weights of sustainable dimensions and key performance indicators (KPIs) have been determined using the fuzzy analytic hierarchy process (F-AHP). A fuzzy technique for order of preference by similarity to the ideal solution (F-TOPSIS) has been used to evaluate sustainable performance and rank the alternatives. A total of 16 KPIs were used to develop the framework drawn from literature and experts' opinions. Food quality, revenue growth, and resource utilization are the top three KPIs obtained from F-AHP. The economic factors have the highest weights (0.4), followed by the environment (0.34), circulation (0.16), and social dimensions (0.1). Food quality is ranked first with a weight of 0.16, and human resources are ranked 16th with a weight of 0.01. Through recycling, waste reduction, and waste management, the circular economy in AFSC acts as a support or catalyst for sustainable development and reaching goals like sustainable consumption and production and zero hunger. © 2022 Elsevier Ltd"
"https://www.scopus.com/inward/record.uri?eid=2-s2.0-85124633443&doi=10.1093%2fajcn%2fnqab315&partnerID=40&md5=f44ed61ef50a6c9d05b198017f9f3fa0","Food systems are at the center of a brewing storm consisting of a rapidly changing climate, rising hunger and malnutrition, and significant social inequities. At the same time, there are vast opportunities to ensure that food systems produce healthy and safe food in equitable ways that promote environmental sustainability, especially if the world can come together at the UN Food Systems Summit in late 2021 and make strong and binding commitments toward food system transformation. The NIH-funded Nutrition Obesity Research Center at Harvard and the Harvard Medical School Division of Nutrition held their 22nd annual Harvard Nutrition Obesity Symposium entitled ""Global Food Systems and Sustainable Nutrition in the 21st Century""in June 2021. This article presents a synthesis of this symposium and highlights the importance of food systems to addressing the burden of malnutrition and noncommunicable diseases, climate change, and the related economic and social inequities. Transformation of food systems is possible, and the nutrition and health communities have a significant role to play in this transformative process.  © 2021 The Author(s)."
"https://www.scopus.com/inward/record.uri?eid=2-s2.0-85099936978&doi=10.3390%2fijerph18031175&partnerID=40&md5=6b609de66c26d6f48384296d2a1f52c3","Micronutrient malnutrition, also known as hidden hunger, continues to affect more than 2 billion people globally. Biofortification, which is a process of breeding staple crops with improved micronutrient contents such as vitamin A, iron, and zinc, offers a cost‐effective and sustainable solution in reducing hidden hunger. However, the success of these foods depends on consumer acceptance. In contrast to previous studies, this research focuses on the mechanism of consumer acceptance of biofortified crops that undergo physical changes (i.e., changes in appearance) after biofortification. We use data on 473 Chinese consumers collected through online surveys to examine their purchase intentions for biofortified foods that have visible (vs. invisible) nutrition traits. Using two online surveys, we conduct two studies to reveal the mechanism and antecedents of consumer acceptance of different biofortified foods. In Study 1, we find that consumer purchase intentions vary depending upon the visibility of nutrition traits in biofortified foods. Specifically, consumers exhibit a nutrition‐related food neophobia (NFN) regardless of visibility of the nutrition trait in biofortified foods; and a sensory‐affective food neophobia (SFN) which is only pronounced when the nutrition trait in biofortified foods is visible. The results of the mediation analysis show that for both types of biofortified foods, NFN mediates consumers’ purchasing intentions. For foods that involve visible changes after biofortification, SFN acts as an additional mediator of consumer purchase intentions. Using ordered logistic regression analysis, we find that both food neophobias have a negative impact on consumer acceptance of biofortified foods. The results of Study 2 confirm our findings and further show that nutrition information moderates the mediation of NFN and SFN, i.e., the negative impact of NFN and SFN on purchase intentions can be reduced by providing nutrition information to consumers. The results of this study have several theoretical and practical implications and are of interest to stakeholders and marketers in the promotion of biofortified foods. © 2021 by the authors. Licensee MDPI, Basel, Switzerland."
"https://www.scopus.com/inward/record.uri?eid=2-s2.0-85094325467&doi=10.1016%2fj.spc.2020.10.022&partnerID=40&md5=62bfc6326d7eb5dd809e31482c63310c","Excessive food waste (nearly 1.3 billion tons per annum) has exacerbated the world hunger crisis. This comprehensive review focuses on the food waste scenario, adverse effects, food waste management, existing waste management policies, and regulations in Bangladesh. Municipalities and urban centers generate 3.78 million tons of waste each year (15.96% of total food waste). This study utilized the national database to analyze food waste generation and projected growth by the year 2050. Yearly an estimated 17215.2 thousand acres of land and a significant amount of natural resources (water, energy) are being used to produce 23691.15 thousand tons of wasted food (45% of total food production). This study critically analyzed the waste management policy gap of Bangladesh and clearly identified each stage of the food loss production supply chain. The study assessed that yearly 481.6 MW energy could be generated from food waste. Focusing on effective policy and sustainability, a national food waste management model has been proposed for Bangladesh in compliance with sustainable development goals 12.3.1 global food loss. Food accumulates 16.7% to 20% of the world economy; therefore, any measures taken to reduce the food waste will be economically beneficial and environmentally sustainable. © 2020"
"https://www.scopus.com/inward/record.uri?eid=2-s2.0-85124234743&doi=10.1016%2fj.tifs.2021.12.003&partnerID=40&md5=0c7257eb74d3fd8bc9bf69f10d38f10f","Background: Severe acute respiratory coronavirus syndrome 2 (SARS-CoV-2) is the etiological agent of coronavirus disease 2019 (COVID-19). SARS-CoV-2 was first detected in Wuhan, China and spread to other countries and continents causing a variety of respiratory and non-respiratory symptoms which led to death in severe cases. Scope and approach: In this review, we discuss and analyze the impact of the COVID-19 pandemic on animal production systems and food production of meat, dairy, eggs, and processed food, in addition to assessing the impact of the pandemic on animal healthcare systems, animal healthcare quality, animal welfare, food chain sustainability, and the global economy. We also provide effective recommendations to animal producers, veterinary healthcare professionals, workers in animal products industries, and governments to alleviate the effects of the pandemic on livestock farming and production systems. Key findings and conclusions: Port restrictions, border restrictions, curfews, and social distancing limitations led to reduced quality, productivity, and competitiveness of key productive sectors. The restrictions have hit the livestock sector hard by disrupting the animal feed supply chain, reducing animal farming services, limiting animal health services including delays in diagnosis and treatment of diseases, limiting access to markets and consumers, and reducing labor-force participation. The inhumane culling of animals jeopardized animal welfare. Egg smashing, milk dumping, and other animal product disruptions negatively impacted food production, consumption, and access to food originating from animals. In summary, COVID-19 triggered lockdowns and limitations on local and international trade have taken their toll on food production, animal production, and animal health and welfare. COVID-19 reverberations could exacerbate food insecurity, hunger, and global poverty. The effects could be massive on the most vulnerable populations and the poorest nations. © 2022 Elsevier Ltd"
"https://www.scopus.com/inward/record.uri?eid=2-s2.0-85120733481&doi=10.35784%2fpe.2022.1.22&partnerID=40&md5=132ff140521438255e0541480d726636","This study applied a panel data of 37 African countries in examining the impact of trade openness and foreign direct investment on sustainable agriculture towards the attainment of the United Nation (UN) Sustainable Development Goals (SDGs), especially, SDG-2, with the aim of ending extreme hunger, achieve food security and improve nutrition and promote sustainable agriculture. Data for the study was sourced from the Country Policy and Institutional Assessment (CPIA) and World Development Indicators (WDI) of the World Bank, for the period 2005-2019. To control for endogeneity, the study engaged the system Generalised Method of Moments (GMM). The result shows that FDI and trade openness have significant negative impact on agricultural sustainability in Africa. This result implies that, increase in FDI may decrease agricultural sustainability by 0.00294%, while increase in trade openness may lower agricultural sustainability by 0.430066 %. Therefore, the study concludes that while trade openness is negative, policy to raise local production towards export promotion should be encouraged. In addition, FDI should be encouraged to augment local employment and investment towards increasing output and productivity in the Africa region. © 2022, Politechnika Lubelska. All rights reserved."
"https://www.scopus.com/inward/record.uri?eid=2-s2.0-85115891316&doi=10.3390%2fcells10092428&partnerID=40&md5=2e9e4ac3063c8b7b9ed367e0db1a4178","The global community decided in 2015 to improve people’s lives by 2030 by setting 17 global goals for sustainable development. The second goal of this community was to end hunger. Plant seeds are an essential input in agriculture; however, during their developmental stages, seeds can be negatively affected by environmental stresses, which can adversely affect seed vigor, seedling establishment, and crop production. Seeds resistant to high salinity, droughts and climate change can result in higher crop yield. The major findings suggested in this review refer nanopriming as an emerging seed technology towards sustainable food amid growing demand with the increasing world population. This novel growing technology could influence the crop yield and ensure the quality and safety of seeds, in a sustainable way. When nanoprimed seeds are germinated, they undergo a series of synergistic events as a result of enhanced metabolism: modulating biochemical signaling pathways, trigger hormone secretion, reduce reactive oxygen species leading to improved disease resistance. In addition to providing an overview of the challenges and limitations of seed nanopriming technology, this review also describes some of the emerging nano-seed priming methods for sustainable agriculture, and other technological developments using cold plasma technology and machine learning. © 2021 by the authors. Licensee MDPI, Basel, Switzerland."
"https://www.scopus.com/inward/record.uri?eid=2-s2.0-85115395316&doi=10.1016%2fj.maturitas.2021.09.007&partnerID=40&md5=446913a45f6435fdb98ef235c4c79ac5","Health problems of women experiencing homelessness are driven either from the usual background characteristics of this population, or from the homeless lifestyle. Apart from poverty and unemployment, transition to homelessness is often associated with substance abuse, history of victimization, stress, poor mental health and human immunodeficiency virus (HIV). Water insecurity can undermine bodily hygiene and dental health, posing a greater risk of dehydration and opportunistic infections. Exposure to extreme environmental conditions like heat waves and natural disasters increases morbidity, accelerates aging, and reduces life expectancy. Nutrition-wise, a high prevalence of food insecurity, obesity, and micronutrient deficiencies are apparent due to low diet quality and food waste. Poor hygiene, violence, and overcrowding increase the susceptibility of these women to communicable diseases, including sexually transmitted ones and COVID-19. Furthermore, established cardiovascular disease and diabetes mellitus are often either undertreated or neglected, and their complications are more widespread than in the general population. In addition, lack of medical screening and contraception non-use induce a variety of reproductive health issues. All these health conditions are tightly related to violations of human rights in this population, including the rights to housing, water, food, reproduction, health, work, and no discrimination. Thus, the care provided to women experiencing homelessness should be optimized at a multidimensional level, spanning beyond the provision of a warm bed, to include access to clean water and sanitation, psychological support and stress-coping strategies, disease management and acute health care, food of adequate quality, opportunities for employment and support for any minor dependants. © 2021 Elsevier B.V."
"https://www.scopus.com/inward/record.uri?eid=2-s2.0-85141834272&doi=10.3390%2fsu142113894&partnerID=40&md5=75a18cb3048d1103992c606d4cc5c292","In 2015, approximately 195 countries agreed with the United Nations that by 2030, they would work to make the world a better place. There would be synergies in accomplishing the 17 Sustainable Development Goals (SDGs). Synergy using a single sustainable resource is critical to assist developing nations in achieving the SDGs as cost-effectively and efficiently possible. To use fungal dye resources, we proposed a combination of the zero hunger and affordable energy goals. Dyes are widely used in high-tech sectors, including food and energy. Natural dyes are more environment-friendly than synthetic dyes and may have medicinal benefits. Fungi are a natural source of dye that can be substituted for plants. For example, medicinal mushrooms offer a wide range of safe organic dyes that may be produced instantly, inexpensively, and in large quantities. Meanwhile, medicinal mushroom dyes may provide a less expensive choice for photovoltaic (PV) technology due to their non-toxic and environmentally friendly qualities. This agenda thoroughly explains the significance of pigments from medicinal mushrooms in culinary and solar PV applications. If executed effectively, such a large, unwieldy and ambitious agenda may lead the world towards inclusive and sustainable development. © 2022 by the authors."
"https://www.scopus.com/inward/record.uri?eid=2-s2.0-85116118796&doi=10.1007%2fs00299-021-02790-6&partnerID=40&md5=5278bdfa04c4722d2b1d985a0e39a9bd","Key message: An integrated research approach to ensure sustainable rice yield increase of a crop grown by 25% of the world’s farmers in 10% of cropland is essential for global food security. Abstract: Rice, being a global staple crop, feeds about 56% of the world population and sustains 40% of the world’s poor. At ~ $200 billion, it also accounts for 13% of the annual crop value. With hunger and malnutrition rampant among the poor, rice research for development is unique in global food and nutrition security. A systems-based, sustainable increase in rice quantity and quality is imperative for environmental and biodiversity benefits. Upstream ‘discovery’ through biotechnology, midstream ‘development’ through breeding and agronomy, downstream ‘dissemination and deployment’ must be ‘demand-driven’ for ‘distinct socio-economic transformational impacts’. Local agro-ecology and livelihood nexus must drive the research agenda for targeted benefits. This necessitates sustained long-term investments by government, non-government and private sectors to secure the future food, nutrition, environment, prosperity and equity status. © 2021, The Author(s), under exclusive licence to Springer-Verlag GmbH Germany, part of Springer Nature."
"https://www.scopus.com/inward/record.uri?eid=2-s2.0-85111070395&doi=10.1016%2fj.rser.2021.111416&partnerID=40&md5=8f5dd80f1f4bbab138bec7863d6d92be","The water-energy-food (WEF) nexus facilitates understanding of the intricate and dynamic interlinkages among the three resources. Its implementation can enhance resource securities and sustainable development. Despite its potential, full adoption of the approach has been hindered by a lack of actionable strategies to guide its practical application. This is attributed to (i) poor data (ii) lack of empirical evidence, (iii) inadequate analytical tools, and (iv) lack of clarity on applicable spatial scale. This study undertook a literature review, coupled with systemic analyses of a WEF nexus analytical model, whose outputs were used as a basis to develop a Theory of Change, an iterative outline for operationalising the approach in the context of southern Africa. The consultative and iterative Theory of Change culminated with the formulation of pathways to (i) overcome the barriers impeding WEF nexus operationalisation, (ii) mitigation of trade-offs while enhancing synergies towards attaining simultaneous resource securities, (iii) poverty alleviation and reduction of inequalities, and (iv) reconciling policy with implementation scale. The WEF nexus operationalisation outcomes are linked to Sustainable Development Goals 2 (zero hunger), 6 (clean water and sanitation), and 7 (affordable and clean energy), with synergies to SDGs 1 (no poverty), 5 (gender equality), 8 (decent work and economic growth), 12 (responsible consumption and production), 13 (climate action), 14 (life below water), and 15 (life on land). Operationalising the WEF nexus through an interactive process can inform sustainable pathways towards resource security, job and wealth creation, improved livelihoods and well-being, and regional integration. © 2021 The Author(s)"
"https://www.scopus.com/inward/record.uri?eid=2-s2.0-85102091181&doi=10.1093%2fnutrit%2fnuaa035&partnerID=40&md5=fceeafeead20ce9c809c770279b8b787","Emerging research demonstrates unexpected relationships between food waste, nutrition, and environmental sustainability that should be considered when developing waste reduction strategies. In this narrative review, we synthesize these linkages and the evidence related to drivers of food waste and reduction strategies at the consumer level in the United States. Higher diet quality is associated with greater food waste, which results in significant quantities of wasted resources (e.g., energy, fertilizer) and greenhouse gas emissions. Food waste also represents waste of micronutrients that could otherwise theoretically fill nutritional gaps for millions of people. To make progress on these multiple fronts simultaneously, nutrition professionals must expand beyond their traditional purview, into more interdisciplinary arenas that make connections with food waste and environmental sustainability.  © 2020 The Author(s) 2020. Published by Oxford University Press on behalf of the International Life Sciences Institute. All rights reserved. For permissions, please e-mail: journals.permissions@oup.com."
"https://www.scopus.com/inward/record.uri?eid=2-s2.0-85128069121&doi=10.1016%2fB978-0-12-824296-4.00008-6&partnerID=40&md5=6e8da72c4d978dc2e1ae00a5e0d9274b","Whereas the importance and the role of the small-scale fisheries in fish production toward global food and nutrition security have been well ventilated in literature, attention to postharvest practices remains limiting. Challenges with respect to postharvest practices are further complicated by well-known facts that small-scale fisheries suffer from lack of voice, vulnerability, contributions being undervalued or not valued at all, rural driving and being far from markets, and a host of issues. In most context the operators have low financial capabilities and are not able to access sustainable solutions to solving postharvest extant limitations confronting their operations and working technological packages. This chapter appraises the types and forms of postharvest practices and limitations to adopting what works in small-scale fisheries postharvest ways. Our chapter noted that postharvest activities remain critical to eliminating hunger and the midpoints between field harvest and consumption in the fisheries value chain. New recommendations were offered with the hope of influencing policy changes required in achieving sustainable postharvest practices in small-scale fisheries and increasing food and nutritional security. Recommendations were offered, especially the need to implement the SSF Guidelines toward a sustainable postharvest approach. The sustainable postharvest system is pertinent to attaining many of the Sustainable Development Goals, especially SDG 1, 2, and 12. © 2022 Elsevier Inc. All rights reserved."
"https://www.scopus.com/inward/record.uri?eid=2-s2.0-85129759210&doi=10.2478%2febtj-2022-0007&partnerID=40&md5=4f0c1e89b2ee051c4f68fbe647af7047","Background: Industrial Biotechnology (""White Biotechnology"") is the large-scale production of materials and chemicals using renewable raw materials along with biocatalysts like enzymes derived from microorganisms or by using microorganisms themselves (""whole cell biocatalysis""). While the production of ethanol has existed for several millennia and can be considered a product of Industrial Biotechnology, the application of complex and engineered biocatalysts to produce industrial scale products with acceptable economics is only a few decades old. Bioethanol as fuel, lactic acid as food and PolyHydroxyAlkanoates (PHA) as a processible material are some examples of products derived from Industrial Biotechnology. Purpose and Scope: Industrial Biotechnology is the sector of biotechnology that holds the most promise in reducing our dependence on fossil fuels and mitigating environmental degradation caused by pollution, since all products that are made today from fossil carbon feedstocks could be manufactured using Industrial Biotechnology - renewable carbon feedstocks and biocatalysts. To match the economics of fossil-based bulk products, Industrial Biotechnology-based processes must be sufficiently robust. This aspect continues to evolve with increased technological capabilities to engineer biocatalysts (including microorganisms) and the decreasing relative price difference between renewable and fossil carbon feedstocks. While there have been major successes in manufacturing products from Industrial Biotechnology, challenges exist, although its promise is real. Here, PHA biopolymers are a class of product that is fulfilling this promise. Summary and Conclusion: The authors illustrate the benefits and challenges of Industrial Biotechnology, the circularity and sustainability of such processes, its role in reducing supply chain issues, and alleviating societal problems like poverty and hunger. With increasing awareness among the general public and policy makers of the dangers posed by climate change, pollution and persistent societal issues, Industrial Biotechnology holds the promise of solving these major problems and is poised for a transformative upswing in the manufacture of bulk chemicals and materials from renewable feedstocks and biocatalysts.  © 2022 Anindya Mukherjee et al., published by Sciendo."
